{
  "$schema": "schemas/state.schema.json",
  "schema_version": 2,
  "last_updated": "2026-08-26",
  "repository_phase": "active-multi-track-learning",
  "active_track": null,
  "last_completed_lesson": null,
  "next_planned_item": "Continue public-first authoring through audited curriculum graphs. Current publication frontiers after this transaction: LA-0004, LNX-0010, GER-0001, LLM-0005, PHL-0004, FUS-0004, PWR-0004, and NNE-0002. Use per-track graph state for exact next authoring candidates.",
  "legacy_linux_policy": "Do not silently reuse removed legacy lessons; salvage only after explicit review.",
  "persistent_decisions": [
    "Repository filenames, structural documentation, and educational content are written in English.",
    "No track has a permanent endpoint; L6 research-frontier work remains open-ended.",
    "Canonical structured state is stored in JSON; Markdown ledgers and indexes are generated human-readable views.",
    "Normal AI sessions use targeted retrieval; recursive full-track reading is reserved for explicit audit modes.",
    "Audited coverage is a real publication gate: it requires registered evidence sources, mapped coverage items, and no unresolved gaps.",
    "Authoring readiness and learner study readiness are separate workflows.",
    "Tracks may be top-level or nested under organizational containers; a directory is a track only if it contains TRACK.json.",
    "Current active public-authoring tracks include Linear Algebra, Linux Systems, German Language, Large Language Models, Philosophy and Logic, Fusion Energy, and Electrical Engineering — Power Engineering; publication state remains separate from learner mastery.",
    "Public lesson authoring prioritizes educational quality and prerequisite integrity; it does not wait for repository-owner learner progress.",
    "Educational content is CC BY-SA 4.0; repository software is GPL-3.0-or-later, with explicit attribution and provenance guidance.",
    "Philosophy and Logic is activated only after evidence-backed curriculum reconnaissance; public lesson quality does not depend on repository-owner learner state.",
    "Repository-wide handoff summaries report publication frontiers without claiming learner completion; learner progress remains in per-track learner state."
  ]
}
